{"schemaVersion":1,"stepId":"0001","outcome":"kept","selectionPath":".pi/jig/steps/0001/selection.json","selectionSha256":"bbbbbbbbbbbbbbbbbbbbbbbbbbbbbbbbbbbbbbbbbbbbbbbbbbbbbbbbbbbbbbbb","proposalPath":".pi/jig/steps/0001/proposal.json","proposalSha256":"cccccccccccccccccccccccccccccccccccccccccccccccccccccccccccccccc","inputRevision":"1111111111111111111111111111111111111111","outputRevision":"2222222222222222222222222222222222222222","branch":"feat/first-step","worktree":".pi/jig/worktrees/0001","commands":[{"command":"python3 -m unittest","exitCode":0,"receiptPath":".pi/jig/steps/0001/receipts/unittest.txt","outputSha256":"dddddddddddddddddddddddddddddddddddddddddddddddddddddddddddddddd","finishedAt":"2026-08-28T12:29:00Z"}],"diffSha256":"eeeeeeeeeeeeeeeeeeeeeeeeeeeeeeeeeeeeeeeeeeeeeeeeeeeeeeeeeeeeeeee","independentVerdict":null,"recordedAt":"2026-08-28T12:30:00Z"}
